<?xml version="1.0" encoding="UTF-8"?>
<!--
Licensed to the Apache Software Foundation (ASF) under one
or more contributor license agreements.  See the NOTICE file
distributed with this work for additional information
regarding copyright ownership.  The ASF licenses this file
to you under the Apache License, Version 2.0 (the
"License"); you may not use this file except in compliance
with the License.  You may obtain a copy of the License at

http://www.apache.org/licenses/LICENSE-2.0

Unless required by applicable law or agreed to in writing,
software distributed under the License is distributed on an
"AS IS" BASIS, WITHOUT WARRANTIES OR CONDITIONS OF ANY
KIND, either express or implied.  See the License for the
specific language governing permissions and limitations
under the License.
-->

<api name="ExampleRestApi"
     displayName="Example REST API"
     path="example-rest"
     description="This API exposes example services as REST endpoints."
     xmlns:xsi="http://www.w3.org/2001/XMLSchema-instance"
     xsi:noNamespaceSchemaLocation="https://ofbiz.apache.org/dtds/rest-api.xsd">

    <resource name="ExampleResource"
              path="example"
              displayName="Example Resource"
              description="Handles example-related operations">

        <operation verb="post" description="Create Example"
                   consumes="application/json">
            <service name="createExample"/>
        </operation>

        <operation verb="delete" description="Delete Example"
                   consumes="application/json">
            <service name="deleteExample"/>
        </operation>

        <operation verb="put" description="Update Example"
                   consumes="application/json">
            <service name="updateExample"/>
        </operation>

        <operation verb="get" description="Find Example by ID"
                   consumes="application/json">
            <service name="findExampleById"/>
        </operation>
    </resource>

    <resource name="TestRunResource"
              path="testruns"
              displayName="Test Run"
              description="Trigger and poll example component test runs only - componentName is not accepted, permanently scoped to the example component"
              primaryPermission="TESTEXEC"
              mainAction="ADMIN">

        <operation verb="post" description="Trigger a test suite run (scoped to the example component)"
                   consumes="application/json">
            <service name="runExampleTestSuite"/>
        </operation>

        <operation verb="get" description="Get a test run's status (scoped to the example component)"
                   path="{runId}">
            <service name="getExampleTestRunStatus"/>
        </operation>
    </resource>
</api>