<api description="Customers API" displayName="Customers API" name="CustomersAPI" xmlns:xsi="http://www.w3.org/2001/XMLSchema-instance" xsi:noNamespaceSchemaLocation="rest-api.xsd">
  <resource description="" displayName="" enabled="true" name="Customers Resource" path="/hcv1/customers">
    <operation verb="post" description="Creates Customer">
      <service name="createCustomer"/>
    </operation>
    <operation verb="get" path="/{customerPartyId}/" description="Retrieves customer profile">
      <service name="getCustomer"/>
    </operation>
    <operation verb="put" path="/{customerPartyId}" description="Updates customer's personal information">
      <service name="updatePerson"/>
    </operation>
    <operation verb="get" path="/{customerPartyId}/shipping-addresses" description="Retrieves shipping addresses">
      <service name="createCustomerPostalAddress"/>
    </operation>
    <operation verb="post" path="/{customerPartyId}/shipping-addresses" description="Creates shipping address">
      <service name="createCustomerPostalAddress"/>
    </operation>
    <operation verb="put" path="/{customerPartyId}/shipping-addresses/{contactMechId}" description="Updates shipping address">
      <service name="updateCustomerPostalAddress"/>
    </operation>
    <operation verb="post" path="/{customerPartyId}/change-password" description="Changes customer's account password">
      <service name="changePassword"/>
    </operation>
    <operation verb="post" path="/reset-password" description="Sends reset password mail">
      <service name="sendResetPasswordEmail"/>
    </operation>
    <operation verb="delete" path="/{customerPartyId}/shipping-addresses/{contactMechId}" description="Expires shipping address">
      <service name="removeCustomerContactMech"/>
    </operation>
    <operation verb="get" path="/{customerPartyId}/payment-methods" description="Get payment methods(credit card, gift card, eft account)">
      <service name="getPartyPaymentMethods"/>
    </operation>
    <operation verb="post" path="/{customerPartyId}/payment-methods" description="Creates payment method(credit card, gift card, eft account)">
      <service name="createCustomerPaymentMethod"/>
    </operation>
    <operation verb="put" path="/{customerPartyId}/payment-methods/{paymentMethodId}" description="Updates payment method(credit card, gift card, eft account)">
      <service name="updateCustomerPaymentMethod"/>
    </operation>
    <operation verb="delete" path="/{customerPartyId}/payment-methods/{paymentMethodId}" description="Deletes payment method(credit card, gift card, eft account)">
      <service name="deleteCustomerPaymentMethod"/>
    </operation>
  </resource>
</api>