<?xml version="1.0" encoding="UTF-8"?>
<!--
Licensed to the Apache Software Foundation (ASF) under one
or more contributor license agreements.  See the NOTICE file
distributed with this work for additional information
regarding copyright ownership.  The ASF licenses this file
to you under the Apache License, Version 2.0 (the
"License"); you may not use this file except in compliance
with the License.  You may obtain a copy of the License at

http://www.apache.org/licenses/LICENSE-2.0

Unless required by applicable law or agreed to in writing,
software distributed under the License is distributed on an
"AS IS" BASIS, WITHOUT WARRANTIES OR CONDITIONS OF ANY
KIND, either express or implied.  See the License for the
specific language governing permissions and limitations
under the License.
-->

<api name="Commerce REST API" path="orders" displayName="Commerce API" description="Commerce REST API endpoints"
    xmlns:xsi="http://www.w3.org/2001/XMLSchema-instance"
    xsi:noNamespaceSchemaLocation="https://ofbiz.apache.org/dtds/rest-api.xsd">

    <resource name="orders" path="/" displayName="Orders Resource" description="Create Order">
        <operation verb="post" consumes="application/json" produces="application/json" description="Create a new Order">
            <service name="commerceCreateOrder"/>
        </operation>
    </resource>

    <resource name="order" path="{orderId}" displayName="Order Resource" description="Get Order details by ID">
        <operation verb="get" produces="application/json" description="Get Order details by ID">
            <service name="commerceGetOrder"/>
        </operation>
        <operation verb="put" consumes="application/json" produces="application/json" description="Update Order details by ID">
            <service name="commerceUpdateOrder"/>
        </operation>
    </resource>

    <resource name="orderStatus" path="{orderId}/status" displayName="Order Status Resource" description="Get Order status details by ID">
        <operation verb="get" produces="application/json" description="Get Order status details by ID">
            <service name="commerceGetOrderStatus"/>
        </operation>
    </resource>

    <resource name="cancelOrder" path="{orderId}/cancel" displayName="Cancel Order Resource" description="Cancel Order by ID">
        <operation verb="post" consumes="application/json" produces="application/json" description="Cancel an Order">
            <service name="commerceCancelOrder"/>
        </operation>
    </resource>

    <resource name="cancelOrderItem" path="{orderId}/items/{orderItemSeqId}/cancel" displayName="Cancel Order Item Resource" description="Cancel Order Item by ID">
        <operation verb="post" consumes="application/json" produces="application/json" description="Cancel an Order Item">
            <service name="commerceCancelOrderItem"/>
        </operation>
    </resource>

    <resource name="closeOrder" path="{orderId}/close" displayName="Close Order Resource" description="Close Order by ID">
        <operation verb="post" consumes="application/json" produces="application/json" description="Close an Order">
            <service name="commerceCloseOrder"/>
        </operation>
    </resource>
</api>
